{
  "settingId": "spuk_im_schlosskeller",
  "bereich": "wahl",
  "hinweis": "Rundenwahl der vier Kernrollen mit Sabotage (Varianten-Regel).",
  "eintraege": [
    {
      "id": "gw_ahmet_1",
      "a": "Ich gebe zu, dass die Miete erfunden war. Ich habe von allen hundertfünfzig Euro kassiert, obwohl der Keller nichts gekostet hat.",
      "b": "Ich schweige. Niemand soll vor dem Morgen erfahren, dass die Miete erfunden war.",
      "sabotage": "Ich halte mich zurück und erzähle lieber von den Stadtfesten, die meine Agentur plant."
    },
    {
      "id": "gw_ahmet_2",
      "a": "Ich sage dem Detektiv, dass Lejla von der Rechnung weiß und mir versprochen hat zu schweigen. Damit bringe ich Lejla in eine blöde Lage.",
      "b": "Lejla und ich halten zusammen. Dem Detektiv sage ich dazu nichts.",
      "sabotage": "Ich erzähle dem Detektiv lieber von meiner Arbeit in der Agentur. Davon gibt es viel zu erzählen."
    },
    {
      "id": "gw_ahmet_3",
      "a": "Ich sage es offen: Die Miete war erfunden. Ich habe von allen hundertfünfzig Euro eingesammelt.",
      "b": "Vor dem Morgen soll niemand erfahren, dass die Miete erfunden war. Ich halte dicht.",
      "sabotage": "Ich halte mich zurück und erzähle lieber, wie viel Arbeit die Planung war."
    },
    {
      "id": "gw_fatma_1",
      "a": "Ich erzähle dem Detektiv, dass ich die Münzschatulle aus der Schauvitrine mitgenommen habe. Am Montag wollte ich sie zurückbringen.",
      "b": "Die Schatulle soll zurück, ohne dass es alle erfahren. Dafür sage ich nichts.",
      "sabotage": "Ich halte mich zurück und erzähle lieber vom Kommunikationsdesign im letzten Semester."
    },
    {
      "id": "gw_fatma_2",
      "a": "Ich glaube, Emine weiß mehr über meinen Abend, als sie sagt. Das erzähle ich dem Detektiv, auch wenn meine beste Freundin dann in der Klemme steckt.",
      "b": "Emine und ich sind seit der Schulzeit beste Freundinnen. Ich halte zu ihr und sage nichts.",
      "sabotage": "Ich erzähle lieber von der Schulzeit. Davon gibt es viel zu erzählen."
    },
    {
      "id": "gw_fatma_3",
      "a": "Ich sage dem Detektiv, dass ich die Münzschatulle mitgenommen habe. Am Montag sollte sie zurück.",
      "b": "Ich schweige. Die Schatulle soll zurück, ohne dass es alle erfahren.",
      "sabotage": "Ich erzähle lieber vom Wiedersehen der Clique. Darüber rede ich viel lieber."
    },
    {
      "id": "gw_olli_1",
      "a": "Ich erzähle dem Detektiv, dass ich die Bogentür beschädigt habe. Die Schramme wollte ich selbst verdecken.",
      "b": "Den Türschaden kläre ich selbst mit Herrn Schneider. Die Gruppe soll da nicht hineingezogen werden.",
      "sabotage": "Ich halte mich zurück und erzähle lieber, wie schön die Feier bis zum Knall war."
    },
    {
      "id": "gw_olli_2",
      "a": "Die Idee mit dem Möbelwachs kam von Wojtek. Das sage ich dem Detektiv, auch wenn mein Kumpel dann Ärger bekommt.",
      "b": "Wojtek hält zu mir, also halte ich zu ihm. Dem Detektiv sage ich nichts.",
      "sabotage": "Ich rede lieber über die Musik und das Buffet. Da gibt es viel zu erzählen."
    },
    {
      "id": "gw_olli_3",
      "a": "Ich rede Klartext: Die Bogentür habe ich beschädigt. Die Schramme wollte ich verdecken.",
      "b": "Den Schaden kläre ich selbst mit Herrn Schneider. Die anderen bleiben außen vor.",
      "sabotage": "Ich erzähle lieber, wie der Abend bisher lief."
    },
    {
      "id": "gw_can_1",
      "a": "Ich erzähle dem Detektiv, dass ich mich mit einer Leuchtmaske im Vorratsraum versteckt habe. Ich wollte die blinde Kuh erschrecken.",
      "b": "Der Streich soll nicht herauskommen. Dafür sage ich nichts.",
      "sabotage": "Ich halte mich zurück und erzähle lieber von der Musik heute Abend."
    },
    {
      "id": "gw_can_2",
      "a": "Zeynep hat für mich Schmiere gestanden. Trotzdem erzähle ich das dem Detektiv.",
      "b": "Zeynep hat für mich Schmiere gestanden. Wenn ich rede, steckt sie mit drin. Ich sage nichts.",
      "sabotage": "Ich erzähle lieber vom Buffet. Darüber rede ich gern."
    },
    {
      "id": "gw_can_3",
      "a": "Ich gebe es zu: Ich habe mich mit der Leuchtmaske versteckt. Die blinde Kuh wollte ich erschrecken.",
      "b": "Ich schweige weiter. Der Streich soll nicht herauskommen.",
      "sabotage": "Ich mache lieber Witze über die Ritterrüstung im Turmgang. Das lockert die Stimmung."
    }
  ]
}
